{
  "schema_version": 1,
  "render_manifest_id": "99999999-9999-4999-8999-999999999999",
  "clip_id": "aaaaaaaa-aaaa-4aaa-8aaa-aaaaaaaaaaaa",
  "source_asset_id": "55555555-5555-4555-8555-555555555555",
  "source_sha256": "aaaaaaaaaaaaaaaaaaaaaaaaaaaaaaaaaaaaaaaaaaaaaaaaaaaaaaaaaaaaaaaa",
  "edit_plan_id": "bbbbbbbb-bbbb-4bbb-8bbb-bbbbbbbbbbbb",
  "edit_plan_schema_version": 1,
  "edit_plan_version": 1,
  "edit_plan_hash": "cccccccccccccccccccccccccccccccccccccccccccccccccccccccccccccccc",
  "audio_plan_id": "88888888-8888-4888-8888-888888888888",
  "audio_plan_schema_version": 1,
  "audio_plan_version": 1,
  "audio_plan_hash": "dddddddddddddddddddddddddddddddddddddddddddddddddddddddddddddddd",
  "render_safe_assets": [],
  "renderer": {
    "honor_media_version": "1.0.0",
    "ffmpeg_version": "9.0.2",
    "opencv_version": "4.14",
    "container_image_digest": "eeeeeeeeeeeeeeeeeeeeeeeeeeeeeeeeeeeeeeeeeeeeeeeeeeeeeeeeeeeeeeee"
  },
  "material_render_parameters": {
    "canvas_width": 1080,
    "canvas_height": 1920,
    "fps": 30,
    "video_codec": "H264",
    "audio_codec": "AAC",
    "pixel_format": "yuv420p",
    "target_integrated_lufs": -15,
    "true_peak_ceiling_dbtp": -1.0
  },
  "output": {
    "object_key": "clips/final.mp4",
    "sha256": "ffffffffffffffffffffffffffffffffffffffffffffffffffffffffffffffff",
    "file_size_bytes": 1234567,
    "duration_ms": 10000
  },
  "qc_run_id": "cccccccc-cccc-4ccc-8ccc-cccccccccccc",
  "qc_version": "qc-v1",
  "qc_passed": true,
  "created_at": "2026-09-20T12:00:00Z",
  "manifest_hash": "1111111111111111111111111111111111111111111111111111111111111111",
  "manifest_hash_rule": "SHA256_RFC8785_CANONICAL_JSON_EXCLUDING_manifest_hash",
  "audio_rule_compliance": {
    "rule_snapshot_id": "66666666-6666-4666-8666-666666666666",
    "planned_music_asset_id": null,
    "planned_sfx_asset_ids": [],
    "instructions_acknowledged": true,
    "verified_exact_asset_match": true
  },
  "campaign_disclosure": {
    "required": false,
    "placement": null,
    "rendered_in_video": false,
    "text_sha256": null
  },
  "campaign_rule_snapshot_id": "66666666-6666-4666-8666-666666666666"
}
